{
  "schemaVersion": "1.0.0-draft.1",
  "contractKind": "catalog-snapshot",
  "snapshotId": "sha256:1111111111111111111111111111111111111111111111111111111111111111",
  "createdAt": "2026-07-27T12:00:00Z",
  "capabilityCatalogDigest": "sha256:2222222222222222222222222222222222222222222222222222222222222222",
  "connectors": [
    {
      "id": "web-platform",
      "connectorVersion": "0.2.0",
      "digest": "sha256:3333333333333333333333333333333333333333333333333333333333333333",
      "reviewStatus": "experimental",
      "selectable": false
    }
  ]
}
